<?xml version="1.0" encoding="UTF-8" standalone="no"?><!--
To change this license header, choose License Headers in Project Properties.
To change this template file, choose Tools | Templates
and open the template in the editor.
--><ns1:PurchaseOrder xmlns:ns1="http://xml.netbeans.org/schema/ProductOrder" xmlns="http://xml.netbeans.org/schema/ProductOrder" xmlns:xsi="http://www.w3.org/2001/XMLSchema-instance" xsi:schemaLocation="http://xml.netbeans.org/schema/ProductOrder ProductOrder.xsd">
    <ns1:ShippingInformation>
        <ns1:Street>Stairway</ns1:Street>
        <ns1:PostalCode>2400</ns1:PostalCode>
        <ns1:City>Copenhagen</ns1:City>
        <ns1:Country>Denmark</ns1:Country>
        <ns1:FirstName>Rasmus</ns1:FirstName>
        <ns1:LastName>Hojte</ns1:LastName>
    </ns1:ShippingInformation>
    <ns1:Order>
        <ns1:Item>
            <ns1:Product>Apple</ns1:Product>
            <ns1:Price>50</ns1:Price>
        </ns1:Item>
        <ns1:Item><ns1:Product>Banana</ns1:Product><ns1:Price>125</ns1:Price></ns1:Item>
        <ns1:Item>
            <ns1:Product>Orange</ns1:Product>
            <ns1:Price>75</ns1:Price>
        </ns1:Item>
        
        <ns1:TotalPrice>100</ns1:TotalPrice>
    </ns1:Order>

</ns1:PurchaseOrder>